{"$schema":"./nautilus-sandbox-comparison-v2.schema.json","bindings":{"current_reference_hash":null,"current_reference_id":null,"first_result_hash":null,"first_result_id":null,"plan_hash":"54f47c96500f3ab5688e629105777f74294370b1f6e957b1094bec896473f414","plan_id":"nautilus_v065_plan_85b7b8379ccbe4378d6495bc158f0151ca2dbd4cf5003326b5acd56241fe3bef","receipt_hash":"43e648587fec1677338ac7c5a37ae90df1b87dc7129e9345a72913c2fba9750e","receipt_id":"nautilus_v065_supply_chain_failure_43e648587fec1677338ac7c5a37ae90df1b87dc7129e9345a72913c2fba9750e","replay_result_hash":null,"replay_result_id":null,"request_hash":null,"request_id":null},"comparison_hash":"60b3083eaedf75a30b05217d8fd90b11ee6afab136727e80ef680d4fbe250989","comparison_id":"nautilus_v065_comparison_60b3083eaedf75a30b05217d8fd90b11ee6afab136727e80ef680d4fbe250989","conclusion":"INCONCLUSIVE_KEEP_CURRENT_CORE","current_core_effect":"UNCHANGED","difference_classes":["SUPPLY_CHAIN_OR_LICENSE_FAILURE"],"gates":{"critical_important_review_zero":true,"exact_supply_chain":false,"fresh_process_replay":false,"golden_scenarios":false,"license_verified":false,"no_unresolved_economic_difference":false,"slsa_attestation":false,"zero_safety_counters":true},"mode":"SUPPLY_CHAIN_FAILURE","reason_code_or_null":"NAUTILUS_V065_PLATFORM_MISMATCH","runner_invocation_count":0,"scenario_comparisons":[],"schema_version":"2.0.0","status":"FINAL_COMPARISON_INCONCLUSIVE"}
